Sheet: bea67 by occ21
A1: . table bea67 occ21 [pw = perwt], cellwidth(10)
L2: occ21
A3: bea67 | B3: Military | C3: MGRS & SAL | D3: LAWYERS & | E3: HEALTH DIA | F3: ACCT & OTH | G3: SALES REP | H3: SCI PROF & | I3: OTHER BUS | J3: TEACHERS | K3: ARTS & LET | L3: MGRS & SAL | M3: B_C SUP & | N3: FARM OWNER | O3: HEALTH & T | P3: CRAFT REPA | Q3: PROT SERV | R3: CLERICAL | S3: OPERATORS | T3: SALES | U3: SERV WORKE | V3: LABORERS | W3: FARM WORKE | X3: total
A4: 0.0 | B4: 3.271065E6 | X4: =SUM(RC[-22]:RC[-1]) -> 3.271065E6
A5: 1.0 | C5: 50526.6 | E5: 18316.9 | F5: 1439.48 | H5: 6315.31 | J5: 11388.8 | K5: 4174.67 | L5: 44662.5 | M5: 3652.34 | N5: 2.284815E6 | O5: 1223.94 | P5: 26162.8 | R5: 31222.9 | S5: 119481.0 | T5: 3291.56 | U5: 18197.2 | V5: 26874.6 | W5: 1.255965E6 | X5: =SUM(RC[-22]:RC[-1]) -> 3.9077106E6
A6: 2.0 | C6: 170384.0 | E6: 29944.8 | F6: 28078.6 | G6: 45641.7 | H6: 13415.2 | J6: 17384.9 | K6: 5042.92 | L6: 60069.0 | M6: 14387.9 | N6: 2.95615E6 | O6: 11950.8 | P6: 51393.6 | R6: 156234.0 | S6: 349075.0 | T6: 7397.97 | U6: 25682.7 | V6: 68575.69999999999 | W6: 1.682497E6 | X6: =SUM(RC[-22]:RC[-1]) -> 5.69330579E6
A7: 14.0 | C7: 540649.0 | E7: 1320.54 | F7: 100279.0 | G7: 256293.0 | H7: 64178.6 | J7: 1582.66 | K7: 20491.1 | L7: 149882.0 | M7: 277989.0 | N7: 2753.09 | O7: 55826.7 | P7: 560090.0 | Q7: 1277.63 | R7: 685521.0 | S7: 2.571009E6 | T7: 66393.69999999999 | U7: 116631.0 | V7: 1.011181E6 | W7: 3925.57 | X7: =SUM(RC[-22]:RC[-1]) -> 6.48727359E6
A8: 15.0 | C8: 10891.7 | F8: 1168.55 | G8: 3967.59 | I8: 2647.63 | M8: 9862.9 | O8: 2414.92 | P8: 11789.9 | R8: 12666.6 | S8: 112757.0 | U8: 2208.41 | V8: 30019.6 | X8: =SUM(RC[-22]:RC[-1]) -> 200394.8
A9: 16.0 | C9: 80515.0 | D9: 23456.0 | F9: 18692.4 | G9: 23937.2 | H9: 13303.6 | I9: 1141.81 | K9: 17880.0 | L9: 4965.869999999999 | M9: 142242.0 | O9: 16644.2 | P9: 161808.0 | R9: 193081.0 | S9: 1.928488E6 | U9: 45450.9 | V9: 181288.0 | X9: =SUM(RC[-22]:RC[-1]) -> 2.85289398E6
L12: occ21
A13: bea67 | B13: Military | C13: MGRS & SAL | D13: LAWYERS & | E13: HEALTH DIA | F13: ACCT & OTH | G13: SALES REP | H13: SCI PROF & | I13: OTHER BUS | J13: TEACHERS | K13: ARTS & LET | L13: MGRS & SAL | M13: B_C SUP & | N13: FARM OWNER | O13: HEALTH & T | P13: CRAFT REPA | Q13: PROT SERV | R13: CLERICAL | S13: OPERATORS | T13: SALES | U13: SERV WORKE | V13: LABORERS | W13: FARM WORKE | X13: total
A14: 0.0 | B14: =R[-10]C/R[-10]C24 -> 1.0 | C14: =R[-10]C/R[-10]C24 -> 0.0 | D14: =R[-10]C/R[-10]C24 -> 0.0 | E14: =R[-10]C/R[-10]C24 -> 0.0 | F14: =R[-10]C/R[-10]C24 -> 0.0 | G14: =R[-10]C/R[-10]C24 -> 0.0 | H14: =R[-10]C/R[-10]C24 -> 0.0 | I14: =R[-10]C/R[-10]C24 -> 0.0 | J14: =R[-10]C/R[-10]C24 -> 0.0 | K14: =R[-10]C/R[-10]C24 -> 0.0 | L14: =R[-10]C/R[-10]C24 -> 0.0 | M14: =R[-10]C/R[-10]C24 -> 0.0 | N14: =R[-10]C/R[-10]C24 -> 0.0 | O14: =R[-10]C/R[-10]C24 -> 0.0 | P14: =R[-10]C/R[-10]C24 -> 0.0 | Q14: =R[-10]C/R[-10]C24 -> 0.0 | R14: =R[-10]C/R[-10]C24 -> 0.0 | S14: =R[-10]C/R[-10]C24 -> 0.0 | T14: =R[-10]C/R[-10]C24 -> 0.0 | U14: =R[-10]C/R[-10]C24 -> 0.0 | V14: =R[-10]C/R[-10]C24 -> 0.0 | W14: =R[-10]C/R[-10]C24 -> 0.0 | X14: =SUM(RC[-22]:RC[-1]) -> 1.0
A15: 1.0 | B15: =R[-10]C/R[-10]C24 -> 0.0 | C15: =R[-10]C/R[-10]C24 -> 0.0129299749065348 | D15: =R[-10]C/R[-10]C24 -> 0.0 | E15: =R[-10]C/R[-10]C24 -> 0.00468737372721511 | F15: =R[-10]C/R[-10]C24 -> 0.000368369141768072 | G15: =R[-10]C/R[-10]C24 -> 0.0 | H15: =R[-10]C/R[-10]C24 -> 0.00161611507259519 | I15: =R[-10]C/R[-10]C24 -> 0.0 | J15: =R[-10]C/R[-10]C24 -> 0.00291444305010714 | K15: =R[-10]C/R[-10]C24 -> 0.00106831606209528 | L15: =R[-10]C/R[-10]C24 -> 0.0114293264194129 | M15: =R[-10]C/R[-10]C24 -> 0.000934649561817602 | N15: =R[-10]C/R[-10]C24 -> 0.584694014955969 | O15: =R[-10]C/R[-10]C24 -> 0.00031321152595077 | P15: =R[-10]C/R[-10]C24 -> 0.00669517338361751 | Q15: =R[-10]C/R[-10]C24 -> 0.0 | R15: =R[-10]C/R[-10]C24 -> 0.00799007480236638 | S15: =R[-10]C/R[-10]C24 -> 0.0305757033286958 | T15: =R[-10]C/R[-10]C24 -> 0.000842324403449938 | U15: =R[-10]C/R[-10]C24 -> 0.00465674198084167 | V15: =R[-10]C/R[-10]C24 -> 0.0068773260742492 | W15: =R[-10]C/R[-10]C24 -> 0.321406861603313 | X15: =SUM(RC[-22]:RC[-1]) -> 1
A16: 2.0 | B16: =R[-10]C/R[-10]C24 -> 0.0 | C16: =R[-10]C/R[-10]C24 -> 0.0299270768661804 | D16: =R[-10]C/R[-10]C24 -> 0.0 | E16: =R[-10]C/R[-10]C24 -> 0.00525965073799417 | F16: =R[-10]C/R[-10]C24 -> 0.00493186226696599 | G16: =R[-10]C/R[-10]C24 -> 0.00801673082098757 | H16: =R[-10]C/R[-10]C24 -> 0.00235631116522199 | I16: =R[-10]C/R[-10]C24 -> 0.0 | J16: =R[-10]C/R[-10]C24 -> 0.00305356863679019 | K16: =R[-10]C/R[-10]C24 -> 0.000885763067365471 | L16: =R[-10]C/R[-10]C24 -> 0.0105508121670731 | M16: =R[-10]C/R[-10]C24 -> 0.00252716093789861 | N16: =R[-10]C/R[-10]C24 -> 0.519232605631745 | O16: =R[-10]C/R[-10]C24 -> 0.0020990968061106 | P16: =R[-10]C/R[-10]C24 -> 0.00902702259384525 | Q16: =R[-10]C/R[-10]C24 -> 0.0 | R16: =R[-10]C/R[-10]C24 -> 0.0274417018447203 | S16: =R[-10]C/R[-10]C24 -> 0.0613132357325918 | T16: =R[-10]C/R[-10]C24 -> 0.00129941553692657 | U16: =R[-10]C/R[-10]C24 -> 0.00451103470414506 | V16: =R[-10]C/R[-10]C24 -> 0.0120449704494091 | W16: =R[-10]C/R[-10]C24 -> 0.295521980034029 | X16: =SUM(RC[-22]:RC[-1]) -> 1
A17: 14.0 | B17: =R[-10]C/R[-10]C24 -> 0.0 | C17: =R[-10]C/R[-10]C24 -> 0.0833399412710756 | D17: =R[-10]C/R[-10]C24 -> 0.0 | E17: =R[-10]C/R[-10]C24 -> 0.000203558549162407 | F17: =R[-10]C/R[-10]C24 -> 0.0154578034375763 | G17: =R[-10]C/R[-10]C24 -> 0.0395070435128665 | H17: =R[-10]C/R[-10]C24 -> 0.0098930003659673 | I17: =R[-10]C/R[-10]C24 -> 0.0 | J17: =R[-10]C/R[-10]C24 -> 0.000243963812847301 | K17: =R[-10]C/R[-10]C24 -> 0.00315866129518363 | L17: =R[-10]C/R[-10]C24 -> 0.0231040047749859 | M17: =R[-10]C/R[-10]C24 -> 0.0428514376869374 | N17: =R[-10]C/R[-10]C24 -> 0.000424383211499486 | O17: =R[-10]C/R[-10]C24 -> 0.00860557200578926 | P17: =R[-10]C/R[-10]C24 -> 0.0863367317918219 | Q17: =R[-10]C/R[-10]C24 -> 0.000196944060131739 | R17: =R[-10]C/R[-10]C24 -> 0.105671664758631 | S17: =R[-10]C/R[-10]C24 -> 0.396315796510133 | T17: =R[-10]C/R[-10]C24 -> 0.0102344535156255 | U17: =R[-10]C/R[-10]C24 -> 0.0179784309050545 | V17: =R[-10]C/R[-10]C24 -> 0.155871489921238 | W17: =R[-10]C/R[-10]C24 -> 0.000605118613472875 | X17: =SUM(RC[-22]:RC[-1]) -> 1
A18: 15.0 | B18: =R[-10]C/R[-10]C24 -> 0.0 | C18: =R[-10]C/R[-10]C24 -> 0.0543512107100583 | D18: =R[-10]C/R[-10]C24 -> 0.0 | E18: =R[-10]C/R[-10]C24 -> 0.0 | F18: =R[-10]C/R[-10]C24 -> 0.00583123913394958 | G18: =R[-10]C/R[-10]C24 -> 0.01979886703647 | H18: =R[-10]C/R[-10]C24 -> 0.0 | I18: =R[-10]C/R[-10]C24 -> 0.0132120693750536 | J18: =R[-10]C/R[-10]C24 -> 0.0 | K18: =R[-10]C/R[-10]C24 -> 0.0 | L18: =R[-10]C/R[-10]C24 -> 0.0 | M18: =R[-10]C/R[-10]C24 -> 0.0492173449610469 | N18: =R[-10]C/R[-10]C24 -> 0.0 | O18: =R[-10]C/R[-10]C24 -> 0.0120508116977087 | P18: =R[-10]C/R[-10]C24 -> 0.0588333629415534 | Q18: =R[-10]C/R[-10]C24 -> 0.0 | R18: =R[-10]C/R[-10]C24 -> 0.063208226959981 | S18: =R[-10]C/R[-10]C24 -> 0.562674280969366 | T18: =R[-10]C/R[-10]C24 -> 0.0 | U18: =R[-10]C/R[-10]C24 -> 0.0110202959358227 | V18: =R[-10]C/R[-10]C24 -> 0.149802290278989 | W18: =R[-10]C/R[-10]C24 -> 0.0 | X18: =SUM(RC[-22]:RC[-1]) -> 1
A19: 16.0 | B19: =R[-10]C/R[-10]C24 -> 0.0 | C19: =R[-10]C/R[-10]C24 -> 0.0282222194601147 | D19: =R[-10]C/R[-10]C24 -> 0.00822182673609203 | E19: =R[-10]C/R[-10]C24 -> 0.0 | F19: =R[-10]C/R[-10]C24 -> 0.0065520836494597 | G19: =R[-10]C/R[-10]C24 -> 0.00839049756766636 | H19: =R[-10]C/R[-10]C24 -> 0.00466319466943528 | I19: =R[-10]C/R[-10]C24 -> 0.000400228682875905 | J19: =R[-10]C/R[-10]C24 -> 0.0 | K19: =R[-10]C/R[-10]C24 -> 0.00626732017570453 | L19: =R[-10]C/R[-10]C24 -> 0.00174064302242315 | M19: =R[-10]C/R[-10]C24 -> 0.0498588454380629 | N19: =R[-10]C/R[-10]C24 -> 0.0 | O19: =R[-10]C/R[-10]C24 -> 0.00583414599935466 | P19: =R[-10]C/R[-10]C24 -> 0.0567171444625503 | Q19: =R[-10]C/R[-10]C24 -> 0.0 | R19: =R[-10]C/R[-10]C24 -> 0.0676789959085686 | S19: =R[-10]C/R[-10]C24 -> 0.675976048713875 | T19: =R[-10]C/R[-10]C24 -> 0.0 | U19: =R[-10]C/R[-10]C24 -> 0.0159315068553652 | V19: =R[-10]C/R[-10]C24 -> 0.0635452986584521 | W19: =R[-10]C/R[-10]C24 -> 0.0 | X19: =SUM(RC[-22]:RC[-1]) -> 1